{
  "schema_version": "context_fabric_investigation_result.v1",
  "result_id": "result_status_corrected",
  "request_id": "request_12345678",
  "generated_at": "2026-08-11T16:00:03Z",
  "status": "degraded",
  "question": "Most of the work is closed, so why is Ask Dev still not ready to ship?",
  "interpretation": {
    "shape": "single_subject",
    "requested_judgment": "release_readiness_and_current_drivers",
    "subject_terms": [
      "Ask Dev"
    ],
    "comparison_terms": [],
    "time_context": {
      "axis": "current"
    },
    "fact_requirements": [
      {
        "kind": "status",
        "subjects": [
          {
            "kind": "project",
            "canonical_id": "project_ask_dev",
            "label": "Ask Dev"
          }
        ]
      },
      {
        "kind": "readiness",
        "subjects": [
          {
            "kind": "project",
            "canonical_id": "project_ask_dev",
            "label": "Ask Dev"
          }
        ]
      },
      {
        "kind": "blockers",
        "subjects": [
          {
            "kind": "project",
            "canonical_id": "project_ask_dev",
            "label": "Ask Dev"
          }
        ]
      }
    ],
    "clarification_needed": false
  },
  "subject_resolution": {
    "candidates": [
      {
        "receipt_id": "receipt_12345678",
        "subject": {
          "kind": "project",
          "canonical_id": "project_ask_dev",
          "label": "Ask Dev"
        },
        "state": "committed",
        "matched_terms": [
          "Ask Dev"
        ],
        "match_reasons": [
          "Exact canonical project label."
        ],
        "confidence": 1.0,
        "match_mechanisms": [
          "exact"
        ],
        "evidence_ref_ids": [
          "evidence_project_identity"
        ]
      }
    ],
    "committed": [
      {
        "kind": "project",
        "canonical_id": "project_ask_dev",
        "label": "Ask Dev"
      }
    ],
    "commit_decision_digests": [
      {
        "subject": {
          "kind": "project",
          "canonical_id": "project_ask_dev",
          "label": "Ask Dev"
        },
        "commit_gate": "exact_index",
        "identity_lookup": "graph_lag"
      }
    ]
  },
  "direct_judgment": "Ask Dev is not release-ready even though most tracked implementation work is closed.",
  "current_state": "Implementation completion and release readiness diverge because required product acceptance remains open.",
  "strongest_pressures": [
    "Release acceptance remains incomplete."
  ],
  "drivers": [
    {
      "driver_id": "driver_12345678",
      "standing": "principal",
      "category": "readiness",
      "title": "Release acceptance remains incomplete",
      "summary": "The project cannot be treated as ready until the required real-product acceptance path succeeds.",
      "affected_subjects": [
        {
          "kind": "project",
          "canonical_id": "project_ask_dev",
          "label": "Ask Dev"
        }
      ],
      "path_ids": [
        "path_12345678"
      ],
      "evidence_ref_ids": [
        "evidence_release_acceptance"
      ],
      "claimed_fact_ids": [
        "claim_readiness_ask_dev"
      ],
      "derivation": "rule_inferred",
      "epistemic_status": "inferred",
      "confidence": 0.96,
      "qualification": "This judgment is limited to currently visible project and acceptance evidence.",
      "current": true
    },
    {
      "driver_id": "cohort-driver-01-1",
      "standing": "principal",
      "category": "operational_deficiency",
      "title": "CHAOS: operational deficiencies",
      "summary": "operational deficiencies (weight 20, value 1.00) contributed 20.0 points to CHAOS's a 43.5 attention score.",
      "affected_subjects": [
        {
          "kind": "team",
          "canonical_id": "team:CHAOS",
          "label": "CHAOS"
        }
      ],
      "evidence_ref_ids": [
        "evidence_team_chaos_roster"
      ],
      "claimed_fact_ids": [
        "claim_cohort_88cad88367c815eae568ce1f979c1471"
      ],
      "derivation": "rule_inferred",
      "epistemic_status": "inferred",
      "confidence": 0.95,
      "current": true
    },
    {
      "driver_id": "cohort-driver-01-2",
      "standing": "contributing",
      "category": "health",
      "title": "CHAOS: health risk",
      "summary": "health risk (weight 25, value 0.50) contributed 12.5 points to CHAOS's a 43.5 attention score.",
      "affected_subjects": [
        {
          "kind": "team",
          "canonical_id": "team:CHAOS",
          "label": "CHAOS"
        }
      ],
      "evidence_ref_ids": [
        "evidence_team_chaos_roster"
      ],
      "claimed_fact_ids": [
        "claim_cohort_ff977441fb1cb96f9023dcff28d4a624"
      ],
      "derivation": "rule_inferred",
      "epistemic_status": "inferred",
      "confidence": 0.95,
      "current": true
    },
    {
      "driver_id": "cohort-driver-01-3",
      "standing": "contributing",
      "category": "readiness",
      "title": "CHAOS: readiness gap",
      "summary": "readiness gap (weight 15, value 0.40) contributed 6.0 points to CHAOS's a 43.5 attention score.",
      "affected_subjects": [
        {
          "kind": "team",
          "canonical_id": "team:CHAOS",
          "label": "CHAOS"
        }
      ],
      "evidence_ref_ids": [
        "evidence_team_chaos_roster"
      ],
      "claimed_fact_ids": [
        "claim_cohort_fbf801c96f78b58f7f50eb3d6c2f57a2"
      ],
      "derivation": "rule_inferred",
      "epistemic_status": "inferred",
      "confidence": 0.95,
      "current": true
    }
  ],
  "remaining_work": [
    {
      "finding_id": "finding_12345678",
      "kind": "narrative",
      "summary": "Complete the real Context Fabric to product acceptance path.",
      "subjects": [
        {
          "kind": "project",
          "canonical_id": "project_ask_dev",
          "label": "Ask Dev"
        },
        {
          "kind": "work_item",
          "canonical_id": "work_release_acceptance",
          "label": "Release acceptance"
        }
      ],
      "evidence_ref_ids": [
        "evidence_release_acceptance"
      ]
    }
  ],
  "readiness_gaps": [],
  "paths": [
    {
      "path_id": "path_12345678",
      "nodes": [
        {
          "kind": "project",
          "canonical_id": "project_ask_dev",
          "label": "Ask Dev"
        },
        {
          "kind": "work_item",
          "canonical_id": "work_release_acceptance",
          "label": "Release acceptance"
        }
      ],
      "edges": [
        {
          "type": "BLOCKS",
          "from": {
            "kind": "project",
            "canonical_id": "project_ask_dev",
            "label": "Ask Dev"
          },
          "to": {
            "kind": "work_item",
            "canonical_id": "work_release_acceptance",
            "label": "Release acceptance"
          },
          "derivation": "canonical_structured",
          "epistemic_status": "observed",
          "observed_at": "2026-08-11T15:59:00Z",
          "evidence_ref_ids": [
            "evidence_release_acceptance"
          ]
        }
      ],
      "why_relevant": "The open acceptance work directly prevents release readiness.",
      "evidence_ref_ids": [
        "evidence_release_acceptance"
      ],
      "truncated": false
    },
    {
      "path_id": "path_belongs_to_repository_1",
      "nodes": [
        {
          "kind": "pull_request",
          "canonical_id": "pull_request:repo_1:42",
          "label": "PR #42"
        },
        {
          "kind": "repository",
          "canonical_id": "repository:repo_1",
          "label": "full-chaos/dev-health-acr"
        }
      ],
      "edges": [
        {
          "type": "BELONGS_TO_REPOSITORY",
          "from": {
            "kind": "pull_request",
            "canonical_id": "pull_request:repo_1:42",
            "label": "PR #42"
          },
          "to": {
            "kind": "repository",
            "canonical_id": "repository:repo_1",
            "label": "full-chaos/dev-health-acr"
          },
          "derivation": "canonical_structured",
          "epistemic_status": "observed",
          "observed_at": "2026-08-11T15:59:00Z",
          "evidence_ref_ids": [
            "acr:v1:pull-request:repo_1:42"
          ]
        }
      ],
      "why_relevant": "The pull request belongs to this repository.",
      "evidence_ref_ids": [
        "acr:v1:pull-request:repo_1:42"
      ],
      "truncated": false
    },
    {
      "path_id": "path_belongs_to_pull_request_1",
      "nodes": [
        {
          "kind": "pull_request_review",
          "canonical_id": "pull_request_review:review_1",
          "label": "PR #42 review"
        },
        {
          "kind": "pull_request",
          "canonical_id": "pull_request:repo_1:42",
          "label": "PR #42"
        }
      ],
      "edges": [
        {
          "type": "BELONGS_TO_PULL_REQUEST",
          "from": {
            "kind": "pull_request_review",
            "canonical_id": "pull_request_review:review_1",
            "label": "PR #42 review"
          },
          "to": {
            "kind": "pull_request",
            "canonical_id": "pull_request:repo_1:42",
            "label": "PR #42"
          },
          "derivation": "canonical_structured",
          "epistemic_status": "observed",
          "observed_at": "2026-08-11T15:59:00Z",
          "evidence_ref_ids": [
            "acr:v1:review:review_1"
          ]
        }
      ],
      "why_relevant": "The review belongs to this pull request.",
      "evidence_ref_ids": [
        "acr:v1:review:review_1"
      ],
      "truncated": false
    },
    {
      "path_id": "path_correlated_with_incident_1",
      "nodes": [
        {
          "kind": "deployment",
          "canonical_id": "deployment:deploy_1",
          "label": "production deployment"
        },
        {
          "kind": "incident",
          "canonical_id": "incident:incident_1",